NÚMERO IDENTIFICATIVO DEL CONTRATO,OBJETO,IMPORTE CON IVA,IMPORTE SIN IVA,ADJUDICATARIO,NIF ADJUDICATARIO,DURACIÓN,TIPO,METADATA
CONP/2025/387,REPUESTOS Y ACCESORIOS RED DE VAPOR DE LAVANDERÍA (PURGADORES) CPR MIXTA,"4.654,27",,EULEN SA,A28517308,,Suministros,"[{""column"": ""Año"", ""value"": ""2025""}, {""column"": ""PYME"", ""value"": ""NO""}, {""column"": ""PROCEDIMIENTO DE LICITACIÓN"", ""value"": ""Menor""}]"
CONP/2025/395,RECAMBIOS MAQUINARIA LAVANDERÍA CPR MIXTA,"3.501,74",,JOSE MANUEL IGNACIO GARCIA RODRIGUEZ SL,B74031782,,Suministros,"[{""column"": ""Año"", ""value"": ""2025""}, {""column"": ""PYME"", ""value"": ""SI""}, {""column"": ""PROCEDIMIENTO DE LICITACIÓN"", ""value"": ""Menor""}]"
CONP/2025/416,REPARACIÓN LAVAPEROLAS CPR MIXTA,"250,47",,JOSE MANUEL IGNACIO GARCIA RODRIGUEZ SL,B74031782,,Servicios,"[{""column"": ""Año"", ""value"": ""2025""}, {""column"": ""PYME"", ""value"": ""SI""}, {""column"": ""PROCEDIMIENTO DE LICITACIÓN"", ""value"": ""Menor""}]"
CONP/2025/517,REPARACIÓN HORNO CPR MIXTA,"1.175,52",,JOSE MANUEL IGNACIO GARCIA RODRIGUEZ SL,B74031782,,Servicios,"[{""column"": ""Año"", ""value"": ""2025""}, {""column"": ""PYME"", ""value"": ""SI""}, {""column"": ""PROCEDIMIENTO DE LICITACIÓN"", ""value"": ""Menor""}]"
CONP/2025/612,TRITURADORAS CPR MIXTA Y CRISTO,"4.487,16",,ESTABLECIMIENTOS ALVAREZ OVIEDO SA,A33060468,,Suministros,"[{""column"": ""Año"", ""value"": ""2025""}, {""column"": ""PYME"", ""value"": ""SI""}, {""column"": ""PROCEDIMIENTO DE LICITACIÓN"", ""value"": ""Menor""}]"
CONP/2025/753,MOTOR DIESEL ESCAPE GRUPO ELECTRÓGENO CPR EL NODO,"4.840,00",,EULEN SA,A28517308,,Servicios,"[{""column"": ""Año"", ""value"": ""2025""}, {""column"": ""PYME"", ""value"": ""NO""}, {""column"": ""PROCEDIMIENTO DE LICITACIÓN"", ""value"": ""Menor""}]"
CONP/2025/1653,REPARACIÓN IMPRESORAS VARIOS CENTROS,"1.648,02",,NEA F3 MASTER SL,B33532722,,Servicios,"[{""column"": ""Año"", ""value"": ""2025""}, {""column"": ""PYME"", ""value"": ""SI""}, {""column"": ""PROCEDIMIENTO DE LICITACIÓN"", ""value"": ""Menor""}]"
CONP/2025/899,SUMINISTRO E INSTALACIÓN LONAS PARA CUBRIR LUCERNARIOS TEJADO CPR MIXTA,"15.290,77",,MARASISTENCIA SERVICIOS SL,B75723197,,Suministros,"[{""column"": ""Año"", ""value"": ""2025""}, {""column"": ""PYME"", ""value"": ""SI""}, {""column"": ""PROCEDIMIENTO DE LICITACIÓN"", ""value"": ""Menor""}]"
CONP/2025/1215,DERMATOSCOPIO CPR MIXTA,"476,44",,AYUDAS AL BIENESTAR SL,B74160219,,Suministros,"[{""column"": ""Año"", ""value"": ""2025""}, {""column"": ""PYME"", ""value"": ""SI""}, {""column"": ""PROCEDIMIENTO DE LICITACIÓN"", ""value"": ""Menor""}]"
CONP/2025/1453,REFORMA Y AMPLIACION INST ELÉCTRICA TRIFÁSICA LAVANDERÍA CPR ARRIONDAS,"2.928,43",,ERGON ELECTRICIDAD SLU,B74060609,,Suministros,"[{""column"": ""Año"", ""value"": ""2025""}, {""column"": ""PYME"", ""value"": ""SI""}, {""column"": ""PROCEDIMIENTO DE LICITACIÓN"", ""value"": ""Menor""}]"
CONP/2025/1452,MESAS AUXILIARES PARA ENCAMADOS VARIOS CENTROS,"1.921,92",,AYUDAS AL BIENESTAR SL,B74160219,,Suministros,"[{""column"": ""Año"", ""value"": ""2025""}, {""column"": ""PYME"", ""value"": ""SI""}, {""column"": ""PROCEDIMIENTO DE LICITACIÓN"", ""value"": ""Menor""}]"
CONP/2025/1486,MATERIAL DE PINTURA CPR SANTA TERESA,"996,97",,EUROTEX TCH SA,A41283920,,Suministros,"[{""column"": ""Año"", ""value"": ""2025""}, {""column"": ""PYME"", ""value"": ""SI""}, {""column"": ""PROCEDIMIENTO DE LICITACIÓN"", ""value"": ""Menor""}]"
CONP/2025/1494,MATERIAL ALBAÑILERÍA CPR SANTA TERESA,"3.833,52",,MARTIN VEGA MAQUINARIA SA,A33630658,,Suministros,"[{""column"": ""Año"", ""value"": ""2025""}, {""column"": ""PYME"", ""value"": ""SI""}, {""column"": ""PROCEDIMIENTO DE LICITACIÓN"", ""value"": ""Menor""}]"
CONP/2024/1497,CAMAS COTA CERO C/CARRO ELEVADOR VARIOS CENTROS,"5.737,82",,AYUDAS AL BIENESTAR SL,B74160219,,Suministros,"[{""column"": ""Año"", ""value"": ""2025""}, {""column"": ""PYME"", ""value"": ""SI""}, {""column"": ""PROCEDIMIENTO DE LICITACIÓN"", ""value"": ""Menor""}]"
CONP/2024/1498,RECAMBIOS MAQUINARIA LAVANDERÍA Y COCINA CPR MIXTA,"3.180,41",,JOSE MANUEL IGNACIO GARCIA RODRIGUEZ SL,B74031782,,Suministros,"[{""column"": ""Año"", ""value"": ""2025""}, {""column"": ""PYME"", ""value"": ""SI""}, {""column"": ""PROCEDIMIENTO DE LICITACIÓN"", ""value"": ""Menor""}]"
CONP/2025/1682,BANDEJAS ISOTÉRMICAS PARA TREN DE LAVADO CPR SANTA TERESA,"3.373,94",,ESTABLECIMIENTOS ALVAREZ OVIEDO SA,A33060468,,Suministros,"[{""column"": ""Año"", ""value"": ""2025""}, {""column"": ""PYME"", ""value"": ""SI""}, {""column"": ""PROCEDIMIENTO DE LICITACIÓN"", ""value"": ""Menor""}]"
CONP/2025/1871,REPUESTOS PARA GRÚAS Y CAMAS VARIOS CENTROS,"11.152,80",,AYUDAS AL BIENESTAR SL,B74160219,,Suministros,"[{""column"": ""Año"", ""value"": ""2025""}, {""column"": ""PYME"", ""value"": ""SI""}, {""column"": ""PROCEDIMIENTO DE LICITACIÓN"", ""value"": ""Menor""}]"
CONP/2025/1735,MÁQUINA Y RECAMBIO LLAVES TERMOESTÁTICAS CPR MIXTA,"953,44",,SUMINISTROS MARTIN VEGA MAQUINARIA SL,A33630658,,Suministros,"[{""column"": ""Año"", ""value"": ""2025""}, {""column"": ""PYME"", ""value"": ""SI""}, {""column"": ""PROCEDIMIENTO DE LICITACIÓN"", ""value"": ""Menor""}]"
CONP/2025/1736,GENERADOR VAPOR CON PLANCHA VAPORIZANTE CPR MIXTA,"936,36",,GARCIA RODRIGUEZ HERMANOS HOST E INSTAL SA,A33630278,,Suministros,"[{""column"": ""Año"", ""value"": ""2025""}, {""column"": ""PYME"", ""value"": ""SI""}, {""column"": ""PROCEDIMIENTO DE LICITACIÓN"", ""value"": ""Menor""}]"
CONP/2025/1755,CAMAS ELÉCTRICAS BARIÁTRICAS C/CARRO ELEVADOR Y COMPONENTES VARIOS CENTROS,"4.810,96",,ORTOPEDIA Y AYUDAS TECNICAS GARMAT SL,B33441544,,Suministros,"[{""column"": ""Año"", ""value"": ""2025""}, {""column"": ""PYME"", ""value"": ""SI""}, {""column"": ""PROCEDIMIENTO DE LICITACIÓN"", ""value"": ""Menor""}]"
CONP/2025/1873,ADECUACION EXTERIOR VALLADO PERIMETRAL CPR LA VEGA-MIERES,"36.300,00",,VALDES OBRAS Y SERVICIOS SL,B02908747,,Obras,"[{""column"": ""Año"", ""value"": ""2025""}, {""column"": ""PYME"", ""value"": ""SI""}, {""column"": ""PROCEDIMIENTO DE LICITACIÓN"", ""value"": ""Menor""}]"
CONP/2025/1875,COORDINACIÓN SEGURIDAD Y SALUD OBRA EXTERIOR CPR LA VEGA,"1.329,79",,DANIEL RODRIGUEZ LOPEZ,***2652**,,Servicios,"[{""column"": ""Año"", ""value"": ""2025""}, {""column"": ""PYME"", ""value"": ""SI""}, {""column"": ""PROCEDIMIENTO DE LICITACIÓN"", ""value"": ""Menor""}]"
CONP/2025/2155,REPARACIÓN CENTRALITAS CPR SANTA TERESA,"1.149,50",,ERCOA INFORMATICA SL,B33855099,,Servicios,"[{""column"": ""Año"", ""value"": ""2025""}, {""column"": ""PYME"", ""value"": ""SI""}, {""column"": ""PROCEDIMIENTO DE LICITACIÓN"", ""value"": ""Menor""}]"
CONP/2025/2137,MANTENIMIENTO DEPÓSITOS PROPANO E INSTALAC RECEPTORAS VARIOS CENTROS,"737,23",,SUPPLY AND GAS SL,B74371840,,Servicios,"[{""column"": ""Año"", ""value"": ""2025""}, {""column"": ""PYME"", ""value"": ""SI""}, {""column"": ""PROCEDIMIENTO DE LICITACIÓN"", ""value"": ""Menor""}]"
CONP/2025/2439,TINTA TÓNER Y LÁSER Y TÓNER RESIDUAL VARIOS CENTROS,"6.777,62",,CLARIN LIBRERIA Y PAPELERIA,B74016932,,Suministros,"[{""column"": ""Año"", ""value"": ""2025""}, {""column"": ""PYME"", ""value"": ""SI""}, {""column"": ""PROCEDIMIENTO DE LICITACIÓN"", ""value"": ""Menor""}]"
CONP/2025/2481,REPARACIONES FUGAS TUBERÍA Y TECHOS RESID NOREÑA,"4.305,18",,EULEN SA,A28517308,,Servicios,"[{""column"": ""Año"", ""value"": ""2025""}, {""column"": ""PYME"", ""value"": ""NO""}, {""column"": ""PROCEDIMIENTO DE LICITACIÓN"", ""value"": ""Menor""}]"
CONP/2025/2977,MATERIAL AUXILIAR DE COCINA Y REPUESTOS CPR SANTA TERESA,"4.120,01",,EQUIHOSVIPE SLU,B33984261,,Suministros,"[{""column"": ""Año"", ""value"": ""2025""}, {""column"": ""PYME"", ""value"": ""SI""}, {""column"": ""PROCEDIMIENTO DE LICITACIÓN"", ""value"": ""Menor""}]"
CONP/2025/2470,REPARACIÓN TREN LAVADO CPR SANTA TERESA,"535,45",,GARCIA RODRIGUEZ HERMANOS HOST E INSTAL SA,A33630278,,Servicios,"[{""column"": ""Año"", ""value"": ""2025""}, {""column"": ""PYME"", ""value"": ""SI""}, {""column"": ""PROCEDIMIENTO DE LICITACIÓN"", ""value"": ""Menor""}]"
