NÚMERO IDENTIFICATIVO DEL CONTRATO,OBJETO,IMPORTE CON IVA,IMPORTE SIN IVA,ADJUDICATARIO,NIF ADJUDICATARIO,DURACIÓN,TIPO,METADATA
CONP/2024/5321,"Veinte posavasos serigrafiados con el logotipo de 
Presidenica del Principado de Asturias","157,30 €","130,00 €",Área de Impresión SL,B74123175,1 MES,Suministro,"[{""column"": ""Dirección General"", ""value"": ""PRESIDENCIA""}, {""column"": ""Fecha de adjudicación"", ""value"": ""10/06/2024""}]"
CONP/2024/3097,"Diez ejemplares del libro ""La Universidad Laboral de 
Gijón: su diseño y sus interiores""","450,00 €","432,69 €","Asociación de Antiguos Alumnos 
de la Universidad Laboral de 
Gijón",G33875782,1 MES,Suministro,"[{""column"": ""Dirección General"", ""value"": ""PRESIDENCIA""}, {""column"": ""Fecha de adjudicación"", ""value"": ""16/04/2024""}]"
CONP/2024/5551,"Suscripción a la edición impresa de ""La Razón""","1.191,67 €","1.145,84 €","Audiovisual Española SA 2000 
SA",A82031329,11 MESES,Suministro,"[{""column"": ""Dirección General"", ""value"": ""PRESIDENCIA""}, {""column"": ""Fecha de adjudicación"", ""value"": ""18/06/2024""}]"
CONP/2024/5338,"Suministro de un conjunto de seis libros relativos al 
protocolo y la organización de actos.","128,36 €","123,42 €",Cervantes Bookshop SL,B74121567,1 DÍA,Suministro,"[{""column"": ""Dirección General"", ""value"": ""PRESIDENCIA""}, {""column"": ""Fecha de adjudicación"", ""value"": ""14/06/2024""}]"
CONP/2024/5143,"Inserción de página a color en la contraportada del 
suplemento especial que publicará El Comercio el 15 
de junio con motivo de la XXI edición de los Premios 
La Voz de Avilés.","2.081,20 €","1.720,00 €",Comercializadora de Medios SL,B33913120,1 DÍA,Servicio,"[{""column"": ""Dirección General"", ""value"": ""PRESIDENCIA""}, {""column"": ""Fecha de adjudicación"", ""value"": ""29/05/2024""}]"
CONP/2024/5597,"Suscripción a la edición impresa del ""ABC""","1.430,00 €","1.430,00 €","Diario ABC, SL",B82824191,11 MESES,Suministro,"[{""column"": ""Dirección General"", ""value"": ""PRESIDENCIA""}, {""column"": ""Fecha de adjudicación"", ""value"": ""21/06/2024""}]"
CONP/2024/5022,"Suscripción a la edición digital del ""ABC""","329,97 €","317,28 €","Diario ABC, SL",B82824194,1 AÑO,Suministro,"[{""column"": ""Dirección General"", ""value"": ""PRESIDENCIA""}, {""column"": ""Fecha de adjudicación"", ""value"": ""10/06/2024""}]"
CONP/2024108,"Suministro de la Edición Impresa del diario Cinco 
Días","390,00 €","390,00 €",Ediciones El Pais SLU,B85635910,11 MESES,Suministro,"[{""column"": ""Dirección General"", ""value"": ""PRESIDENCIA""}, {""column"": ""Fecha de adjudicación"", ""value"": ""04/06/2024""}]"
CONP/2024/4636,"Difusión publicitaria de información de interés
 público en las publicaciones especiales impresas en 
formato revista que editará el diario digital La Voz de 
Asturias a lo largo del año y que distribuirá 
gratuitamente a pie de calle","15.000,37 €","12.397,00 €","Ediciones Periodicas del Noroeste 
SLU",B52512464,7 MESES,Servicio,"[{""column"": ""Dirección General"", ""value"": ""PRESIDENCIA""}, {""column"": ""Fecha de adjudicación"", ""value"": ""15/05/2024""}]"
CONP/2024/5299,Difusión Red Les Escuelines,"18.147,58 €","14.998,00 €",Editorial Prensa Asturiana SAU,A33052283,6 MESES,Servicio,"[{""column"": ""Dirección General"", ""value"": ""PRESIDENCIA""}, {""column"": ""Fecha de adjudicación"", ""value"": ""03/06/2024""}]"
CONP/2024/6319,"Difusión publicitaria, consistente en un faldón de 15 
módulos a color, en la publicación especial que La 
Nueva España va a distribuir junto al periódico del 
día 29 de junio de 2024","2.105,40 €","1.740,00 €",Editorial Prensa Asturiana SAU,A33052283,1 DÍA,Servicio,"[{""column"": ""Dirección General"", ""value"": ""PRESIDENCIA""}, {""column"": ""Fecha de adjudicación"", ""value"": ""26/06/2024""}]"
CONP/2024/4527,Compra de consumibles de alimentación y limpieza,"490,71 €","438,71 €",El Corte Inglés SA,A28017895,15 DIAS,Suministro,"[{""column"": ""Dirección General"", ""value"": ""PRESIDENCIA""}, {""column"": ""Fecha de adjudicación"", ""value"": ""30/05/2024""}]"
CONP/2024/5145,"Suscripción al diario digital ""El Español""","48,00 €","46,15 €","El León de El Español 
Publicaciones SA",A87115226,1 AÑO,Suministro,"[{""column"": ""Dirección General"", ""value"": ""PRESIDENCIA""}, {""column"": ""Fecha de adjudicación"", ""value"": ""10/06/2024""}]"
CONP/2024/4701,"Difusión publicitaria en el digital Extradigital para la 
divulgación de las campañas, convocatorias, 
licitaciones, concursos y premios convocados por las 
distintas consejerías de la Administración del 
Principado de Asturias, y para dar a conocer el portal 
Gobierno Abierto (https://transparencia.asturias.es) y","2.420,00 €","2.000,00 €",Extradigital SL,B42957688,7 MESES,Servicios,"[{""column"": ""Dirección General"", ""value"": ""PRESIDENCIA""}, {""column"": ""Fecha de adjudicación"", ""value"": ""30/05/2024""}]"
CONP/2024/5082,"Suministro de comidas (cáterin) entre el 1 de junio y 
el 31 de agosto de 2024, en la sede de la 
Presidencia del Principado de Asturias","1.650,00 €","1.500,00 €",Javiaranch SL,B33419581,3 MESES,Servicio,"[{""column"": ""Dirección General"", ""value"": ""PRESIDENCIA""}, {""column"": ""Fecha de adjudicación"", ""value"": ""31/05/2024""}]"
CONP/2024/3455,"Difusión publicitaria en el periódico mensual La 
Cuenca del Nalón para difundir informaciones de 
servicio público e interés para los vecinos de los 
concejos de Caso, Sobrescobio, Laviana, San Martín 
del Rey Aurelio y Langreo.","2.420,00 €","2.000,00 €","La Cuenca, Imagen y 
Comunicación SLU",B74143728,8 MESES,Servicio,"[{""column"": ""Dirección General"", ""value"": ""PRESIDENCIA""}, {""column"": ""Fecha de adjudicación"", ""value"": ""24/04/2024""}]"
CONP/2024/4420,Reparación de tres atriles,"6.701,92 €","5.538,78 €",Luminosos Ales SLU,A33638370,15 DIAS,Servicio,"[{""column"": ""Dirección General"", ""value"": ""PRESIDENCIA""}, {""column"": ""Fecha de adjudicación"", ""value"": ""24/05/2024""}]"
CONP/2024/3918,"Diseño y producción de un acto institucional de 
conmemoración del 25 de mayo de 1808 (Día de la 
Bandera de Asturias),","4.196,62 €","3.468,28 €",Mon Event,B37482858,1 DIA,Servicio,"[{""column"": ""Dirección General"", ""value"": ""PRESIDENCIA""}, {""column"": ""Fecha de adjudicación"", ""value"": ""30/04/2024""}]"
CONP/2024/5446,"Difusión publicitaria en el programa AgroPopular, con 
César Lumbreras, del día 6 de julio de 2024, que 
emitirá la cadena COPE desde Covadonga, localidad 
de salida de la primera etapa de la Vuelta a España 
Ultreya Más Sol 2024.","11.374,00 €","9.400,00 €",Radio Popular SA,A28281368,2 DÍAS,Servicio,"[{""column"": ""Dirección General"", ""value"": ""PRESIDENCIA""}, {""column"": ""Fecha de adjudicación"", ""value"": ""18/06/2024""}]"
CONP/2024/4879,"Difusión publicitaria a través del programa de radio 
líder de las mañanas en Asturias Hoy por Hoy, de la 
Cadena SER,","14.520,00 €","12.000,00 €",Radiodifusión SL,B28016970,7 MESES,Servicios,"[{""column"": ""Dirección General"", ""value"": ""PRESIDENCIA""}, {""column"": ""Fecha de adjudicación"", ""value"": ""23/05/2024""}]"
CONP/2024/4821,"Servicio de impresión de fotografías en color de los 
actos de la Presidencia del Principado de Asturias 
durante el año 2023, para los álbumes institucionales 
y envíos","1.500,00 €","1.240,00 €",Samer Fotografía SLU,B74247230,6 MESES,Servicio,"[{""column"": ""Dirección General"", ""value"": ""PRESIDENCIA""}, {""column"": ""Fecha de adjudicación"", ""value"": ""03/06/2024""}]"
CONP/2024/4112,Suscripción al diario digital El Confidencial,"445,00 €","427,88 €",Titania compañía Editorial SL,B82938572,1 AÑO,Suministro,"[{""column"": ""Dirección General"", ""value"": ""PRESIDENCIA""}, {""column"": ""Fecha de adjudicación"", ""value"": ""09/05/2024""}]"
CONP/2024/2626,"Planificación de una campaña de publicidad 
institucional del Gobierno del Principado de Asturias 
que ponga de relieve la importancia que tiene para la 
comunidad autónoma el 25 de mayo de 1808, día de 
la bandera de Asturias.","17.456,67 €","14.427,00 €",TRESALIA COMUNICACIÓN SL,B74017294,1 MES,Servicio,"[{""column"": ""Dirección General"", ""value"": ""PRESIDENCIA""}, {""column"": ""Fecha de adjudicación"", ""value"": ""12/04/2024""}]"
CONP/2024/6283,"Suministro de dos carteles para la celebración del 
acto institucional de suscripción de convenios entre el 
Principado de Asturias y varios ayuntamientos 
asturianos en materia de cooperación para prevenir y 
paliar la soledad no deseada","344,12 €","284,40 €",Tukan Somos Impresores SL,B74429002,1 DÍA,Suministro,"[{""column"": ""Dirección General"", ""value"": ""PRESIDENCIA""}, {""column"": ""Fecha de adjudicación"", ""value"": ""26/06/2024""}]"
CONP/2024/4992,"Suscripción a la edición digital de ""El Mundo""","267,00 €","256,73 €",Unidad Editorial SA,A79102331,1 AÑO,Suministro,"[{""column"": ""Dirección General"", ""value"": ""PRESIDENCIA""}, {""column"": ""Fecha de adjudicación"", ""value"": ""11/06/2024""}]"
CONP/2024/3572,"Servicio de cáterin, para los asistentes a una 
recepción que el próximo 19 de abril de 2024 
ofrecerá el Presidente del Principado de Asturias a 
los alcaldes asturianos que tomaron posesión de sus 
cargos en abril de 1979, tras las primeras elecciones 
municipales democráticas.","288,75 €","262,50 €","Vegapresas (Asociación Una 
Ciudad Para Todos)",G33609330,1 DIA,Servicio,"[{""column"": ""Dirección General"", ""value"": ""PRESIDENCIA""}, {""column"": ""Fecha de adjudicación"", ""value"": ""17/04/2024""}]"
