NÚMERO IDENTIFICATIVO DEL CONTRATO,OBJETO,IMPORTE CON IVA,IMPORTE SIN IVA,ADJUDICATARIO,NIF ADJUDICATARIO,DURACIÓN,TIPO,METADATA
,NEVERA PARA CONSULTORIO FIGUERAS,"249,00 €",,"Electrodomesticos Carlos SL, NIF: B",33300880,10 días,suminitro,
,TONOMETRO DE APLANACIÓN,"2.395,80 €",,"Carl Zeiss Meditec Iberia S.A.U,",A28058337,15 días,suminitro,
,RETINOSCOPIO,"755,04 €",,Topcon Europa Medical BV Sucursal en España,W0086598J,15 días,suministro,
,BIPEDESTADOR,"1.600,47 €",,Ayudas al Bienestar SL Nif: B,74160219,15 días,suministro,
,BICICLETA RECUPERACION,"1.113,20 €",,"Ovidio Suarez Distribuciones, SL Nif: B",52510807,15 días,suministro,
,NEVERA MEDICACIÓN C. LA CARIDAD,"2.148,60 €",,Proquinorte SA,A48202451,20 días,suministro,
,TABURETE DE OFICINA,"133,10 €",,"Comercial Manuel Urones, sl",B33298738,15 días,suministro,
,LIMPIEZA CONSULTORIO PUERTO VEGA,"8.951,16 €",,"Lacera Servicios y Mantenimiento, SA, Nif: A",33123498,5 meses y 6 días,servicio,
,,,,,,,,
